utterance,intent
I hired a housekeeper...I didn’t want to but I’m feeling exhausted to where I’m running on fumes constantly.,not sarcastic
@thecauseendures Everything goes to financial security to be able to afford decent  housing.,not sarcastic
"@ownyourowndata @Algorandd Be nice to add more to my pot, maybe one day i can give some away.. #Algorand",not sarcastic
"So, a country that is trillions in debt, with numbers approaching 13 million on surgical waiting lists and hurtling towards facism regime, is talking about rescuing people from a facist regime?",sarcastic
Why perform at the @BRITs if you’re going to mime? 🧐,not sarcastic
Drum and bass is dangerous stuff don't you know.. #FabricReview 🙏🏻🙏🏻🙏🏻,sarcastic
Just getting some WD40 on my letter box to help the poor postman with his delivery today #valentinesday2021 #WD40,sarcastic
@SeasonIncarnate I think you are wonderful! I adore you! 🍞🤼🎢😎,not sarcastic
Just ate a toasted PB &amp; honey sandwich for lunch. IT WAS ABSOLUTE BLISS. What are you having for lunch today?,not sarcastic
Yay for being locked out of your own  house because you forgot your key,sarcastic
why did no one tell me that SSRIs cause hand shaking/jitters cause this shit sucks,not sarcastic
"Unpopular opinion: a cruise is my idea of hell. 

I don't care how expensive/ luxurious it is, it's a firm no.",not sarcastic
What’s in the pollen this year bcos this hayfever is up in my GRILL,not sarcastic
@c_j_mcburney Suspect there’s still room for you in the ground,sarcastic
life is so much better with a heating blanket,not sarcastic
@dunkindonuts @hannahebridges this is iconic hannah,not sarcastic
IBIZA HAS JUST BEEN BOOKED AGAIN wohooooooooo 🎉👏🎉👏,not sarcastic
"""This is not just a black people issue, this is a HUMAN RIGHTS issue."" Leslie Redmond, President, NAACP Minneapolis",not sarcastic
thank you @Ranboosaysstuff i just shit my pants 👍very cool #ranbooemail,sarcastic
Only posting selfie’s?? On YOUR own Instagram account?? Crazy right,sarcastic
Idk how ppl discuss their mental health issues openly on the internet,not sarcastic
why are salads so expensive?!It's like I'm being punished for tryna eat healthy...,not sarcastic
Xmas shopping all done thank god 😅,not sarcastic
can i get a yeet yeEt for anxiety?,not sarcastic
AS SHE SHOULD https://t.co/v1p2hHIC1i,not sarcastic
Here we go again! We are expecting! Our third baby is due Feb 2022! Absolutely terrified of having 2 under 2 and a 10 year old but we move baby! This is the last addition to the family so going to enjoy this for the very last time ❤️👶🏽,not sarcastic
Cheers @ASOS delivery lady for dropping my parcel off covered in coffee 😒👌🏼 https://t.co/UzY4gJS9DE,sarcastic
so in loveee🥵😍,not sarcastic
i love ingesting poison and then wondering why my tummy is rumbling the next morning,sarcastic
2021 will u think about me ?,not sarcastic
I’m not going to lie I didn’t realise haircuts or should I say “fresh trims” were so important to guys before lockdown💇🏻‍♂️😂,not sarcastic
Not at all concerning that a man's just been round to fiddle with the boiler and now he's left the carbon monoxide alarm won't stop beeping,sarcastic
@TheLunaCinema @seetickets absolutely no response from Luna Cinema and my completely factual review on See Tickets has been moderated and will not be published 🤔 great to see @seetickets looking out for their customers. Excellent customer service all round 👏,sarcastic
Saw @Harry_Styles in Hampstead today. What a fine young specimen of a man. My lord. Handsome. 💚☘️,not sarcastic
Many people have said “I’ll always be here for you”. Only a few have actually meant it &amp; I thank God for those people   every day.,not sarcastic
Holly Arnold ??? Who #ImACeleb  #MBE nope not sure oh hang on you mean MBE yes that’s her !!!,sarcastic
"No joke, air-fried Twisted Teas are THE BEST.",sarcastic
"Yesterday a stranger went into detail telling me how much better her new man is compared to her ex husband at oral sex, and it was a weird conversation but I guess I’m happy for her. New Year new mens.",not sarcastic
I ask myself everyday why did i pick art?,not sarcastic
I would do so much for people that would do absolutely nothing for me lol at least i know who my true friends are😀,sarcastic
"I’m so glad I know the quadratic formula from 8th grade instead of knowing how to pay taxes, get ready for college, oh OR ANYTHING ELSE USEFUL THAT INVOLVES BECOMING AND ADULT 🤠🥰",sarcastic
thunderstorms😍😍,not sarcastic
Does anyone else sit in their car for at least ten minutes to mentally prepare to enter the grocery store?,not sarcastic
"not to brag, but my thesis topic was so good that someone else published on it three months ago 🙃",sarcastic
WHY IS IT SO HARD TO FIND SOMEWHERE TO SWIMMM 🥵,not sarcastic
"Not a single conservative tear then for this absolutely drunk on power statement, but now that Biden makes some vague promises he can’t and won’t back up, they’re absolutely quaking in fear. The crocodile tears are astounding. Hypocrisy is just the conservative platform now.",not sarcastic
